{"$schema":"https://json-schema.org/draft/2020-12/schema","type":"object","required":["schemaVersion","freezeId","requirementId","productVersion","inputs","prototypeSync","localValidation","blockingPendingIds","userDecision"],"properties":{"schemaVersion":{"const":"1.0.0"},"freezeId":{"type":"string","minLength":1},"requirementId":{"type":"string","minLength":1},"productVersion":{"type":"string","minLength":1},"inputs":{"type":"object","required":["prdSha256","prototypeSha256","readerSha256"],"properties":{"prdSha256":{"$ref":"#/$defs/hash"},"prototypeSha256":{"$ref":"#/$defs/hash"},"readerSha256":{"$ref":"#/$defs/hash"}},"additionalProperties":false},"prototypeSync":{"const":"pass"},"localValidation":{"type":"object","required":["status","receiptSha256"],"properties":{"status":{"const":"pass"},"receiptSha256":{"$ref":"#/$defs/hash"}},"additionalProperties":false},"blockingPendingIds":{"type":"array","maxItems":0},"userDecision":{"type":"object","required":["status","sourceRef"],"properties":{"status":{"const":"approved-to-freeze"},"sourceRef":{"type":"object","required":["sourceId","locator","excerpt"],"properties":{"sourceId":{"type":"string","minLength":1},"locator":{"type":"string","minLength":1},"excerpt":{"type":"string","minLength":1}},"additionalProperties":false}},"additionalProperties":false}},"$defs":{"hash":{"type":"string","pattern":"^[a-f0-9]{64}$"}},"additionalProperties":false}
