{"schemaVersion":"1.0.0","freezeId":"FREEZE-EXAMPLE-001","requirementId":"EXAMPLE-REQ","productVersion":"V1.0","inputs":{"prdSha256":"0000000000000000000000000000000000000000000000000000000000000000","prototypeSha256":"0000000000000000000000000000000000000000000000000000000000000000","readerSha256":"0000000000000000000000000000000000000000000000000000000000000000"},"prototypeSync":"pass","localValidation":{"status":"pass","receiptSha256":"0000000000000000000000000000000000000000000000000000000000000000"},"blockingPendingIds":[],"userDecision":{"status":"approved-to-freeze","sourceRef":{"sourceId":"decision-current","locator":"decision:freeze","excerpt":"已确认可以冻结产品三件套"}}}
